{"afterDigest":"sha256:df8ce766af679e0333817103bc6bb3d2cc808faaf78e6fc1518a96178ea834df","archiveManifestDigest":"sha256:ec94cdc4cf64e68445c86e4301d656db8b645d194ce65729b07995506411e0b5","artifactKind":"engine.navigation-effect-receipt","authorityDigest":"sha256:e842b8c76b822f717047c2318b818bd29e19eb7310f0587ee20a70d09c34ae2f","beforeDigest":"sha256:42e4468d5357f2adc0d90f8290496c0b5b716427dfe5f2daad94374d87ad698c","effectId":"effect:e5edcc30ea9164c45dc95d6357b4cb8d","effectsContract":"1.0.0","journalEntryDigest":"sha256:0d93fafc40e0e7ef3eb12611126c62452ee5da959b7fab8bcb474926ef910969","occurredAt":"2026-09-08T21:12:24.443Z","operation":"moc:replace","planDigest":"sha256:cb2cc09763ea55cb848a9c2c92d2f5921a488d95136ec034f93d7bfba7d0846a","policyRef":{"digest":"sha256:bbbbbbbbbbbbbbbbbbbbbbbbbbbbbbbbbbbbbbbbbbbbbbbbbbbbbbbbbbbbbbbb","id":"soak","version":"1"},"reasonCodes":[],"receiptId":"receipt:effect:e5edcc30ea9164c45dc95d6357b4cb8d","sourceContentIncluded":false,"status":"committed","targetPath":"notes/index.md"}
