{"afterDigest":"sha256:f6552f4b55d88f694401be0a76f4d064b408ebe0e3dbe39ba41cecd80662065a","archiveManifestDigest":"sha256:fb1c22508e037215cff2567b0640c7a9cadfb6bfebbf8fb4e2e559cbff83fbfb","artifactKind":"engine.navigation-effect-receipt","authorityDigest":"sha256:e842b8c76b822f717047c2318b818bd29e19eb7310f0587ee20a70d09c34ae2f","effectId":"effect:5934e169db8356d2ecaf47aa8b272c59","effectsContract":"1.0.0","journalEntryDigest":"sha256:522bfeae73f86d04a53b1765a652cd4774d0c96bdcbb6123ed18245730820163","occurredAt":"2026-09-08T20:11:34.399Z","operation":"moc:create","planDigest":"sha256:f88f43475e7a37e59d8820d50a2e11eb99377cefe08759c472f67e861b3fb4ab","policyRef":{"digest":"sha256:bbbbbbbbbbbbbbbbbbbbbbbbbbbbbbbbbbbbbbbbbbbbbbbbbbbbbbbbbbbbbbbb","id":"soak","version":"1"},"reasonCodes":[],"receiptId":"receipt:effect:5934e169db8356d2ecaf47aa8b272c59","sourceContentIncluded":false,"status":"committed","targetPath":"notes/index.md"}
