{"afterDigest":"sha256:15c0c9d0f83abc7718c3a5e57f1c9342919b878c69f77262ca2bb5037e36fbe7","artifactKind":"engine.navigation-effect-receipt","authorityDigest":"sha256:e842b8c76b822f717047c2318b818bd29e19eb7310f0587ee20a70d09c34ae2f","beforeDigest":"sha256:15c0c9d0f83abc7718c3a5e57f1c9342919b878c69f77262ca2bb5037e36fbe7","effectId":"effect:183ee63509860574dc641d93449abc92","effectsContract":"1.0.0","journalEntryDigest":"sha256:ae4e755830447767f26f4c7c80b529c316be65ebb33363aa8d0672dd08098903","occurredAt":"2026-09-08T20:26:49.693Z","operation":"moc:replace","planDigest":"sha256:bb3bf45f356c22afc1f13f0d09d0d30e2656e92942584eb8cb990c80a012fc52","policyRef":{"digest":"sha256:bbbbbbbbbbbbbbbbbbbbbbbbbbbbbbbbbbbbbbbbbbbbbbbbbbbbbbbbbbbbbbbb","id":"soak","version":"1"},"reasonCodes":["BYTE_IDENTICAL"],"receiptId":"receipt:effect:183ee63509860574dc641d93449abc92","sourceContentIncluded":false,"status":"no-op","targetPath":"notes/index.md"}
