{"afterDigest":"sha256:84ff00da2ee974ce11362b7ccd7b6d1fb0c3c01442bb033ca67ea09117ed032b","archiveManifestDigest":"sha256:1b4779c4958895c418a2e12069cecb44d2a17e484d003eb42c25bf76ce409ba9","artifactKind":"engine.navigation-effect-receipt","authorityDigest":"sha256:e842b8c76b822f717047c2318b818bd29e19eb7310f0587ee20a70d09c34ae2f","beforeDigest":"sha256:8aec4721c1f295e0f118bf340f4b8be76c7d8cc764312b3e1dec0f79293fad49","effectId":"effect:43a1cbefa5ce91efae7decc63f1c8e0a","effectsContract":"1.0.0","journalEntryDigest":"sha256:37db3aacf6a92406df5a5d8ae73e97c35b48f0c235708bc83366856c4e75a630","occurredAt":"2026-09-08T21:11:20.227Z","operation":"moc:replace","planDigest":"sha256:d217957d394c5245d500d2014b5c45dd1e48db4b939ba869a64f5ec6b2f1336d","policyRef":{"digest":"sha256:bbbbbbbbbbbbbbbbbbbbbbbbbbbbbbbbbbbbbbbbbbbbbbbbbbbbbbbbbbbbbbbb","id":"soak","version":"1"},"reasonCodes":[],"receiptId":"receipt:effect:43a1cbefa5ce91efae7decc63f1c8e0a","sourceContentIncluded":false,"status":"committed","targetPath":"notes/index.md"}
