{"afterDigest":"sha256:5467db8ee8bb4ce69e4dbc6f97b06cec7b60da7bcea9c999813f504c1b1f055e","artifactKind":"engine.navigation-effect-receipt","authorityDigest":"sha256:e842b8c76b822f717047c2318b818bd29e19eb7310f0587ee20a70d09c34ae2f","beforeDigest":"sha256:5467db8ee8bb4ce69e4dbc6f97b06cec7b60da7bcea9c999813f504c1b1f055e","effectId":"effect:151eb716bdee79082aa09fad8d665996","effectsContract":"1.0.0","journalEntryDigest":"sha256:0a4567c958d39c031d70f43b934e16fe89ce5b2cce41acb563dc8d71d5c5d18c","occurredAt":"2026-09-08T20:17:37.244Z","operation":"moc:replace","planDigest":"sha256:c36528d5427f1096f0df92d06310b2384f505ed65c3c9fb0e8225dced0e8a01e","policyRef":{"digest":"sha256:bbbbbbbbbbbbbbbbbbbbbbbbbbbbbbbbbbbbbbbbbbbbbbbbbbbbbbbbbbbbbbbb","id":"soak","version":"1"},"reasonCodes":["BYTE_IDENTICAL"],"receiptId":"receipt:effect:151eb716bdee79082aa09fad8d665996","sourceContentIncluded":false,"status":"no-op","targetPath":"notes/index.md"}
