{"afterDigest":"sha256:df8ce766af679e0333817103bc6bb3d2cc808faaf78e6fc1518a96178ea834df","artifactKind":"engine.navigation-effect-receipt","authorityDigest":"sha256:e842b8c76b822f717047c2318b818bd29e19eb7310f0587ee20a70d09c34ae2f","beforeDigest":"sha256:df8ce766af679e0333817103bc6bb3d2cc808faaf78e6fc1518a96178ea834df","effectId":"effect:9e41fcb3dffc87db1b4a3c148f75c6ca","effectsContract":"1.0.0","journalEntryDigest":"sha256:ae009bd9d7deb40a519c05bcd8b00978d22ffafb34134292f0f69246119cdebd","occurredAt":"2026-09-08T21:12:29.113Z","operation":"moc:replace","planDigest":"sha256:86167e0c4811f8f588c36315f06dd7a6012d321cf7d3b88b8f33d1b9bf3e4a9e","policyRef":{"digest":"sha256:bbbbbbbbbbbbbbbbbbbbbbbbbbbbbbbbbbbbbbbbbbbbbbbbbbbbbbbbbbbbbbbb","id":"soak","version":"1"},"reasonCodes":["BYTE_IDENTICAL"],"receiptId":"receipt:effect:9e41fcb3dffc87db1b4a3c148f75c6ca","sourceContentIncluded":false,"status":"no-op","targetPath":"notes/index.md"}
