{"afterDigest":"sha256:df8ce766af679e0333817103bc6bb3d2cc808faaf78e6fc1518a96178ea834df","artifactKind":"engine.navigation-effect-receipt","authorityDigest":"sha256:e842b8c76b822f717047c2318b818bd29e19eb7310f0587ee20a70d09c34ae2f","beforeDigest":"sha256:df8ce766af679e0333817103bc6bb3d2cc808faaf78e6fc1518a96178ea834df","effectId":"effect:5306d341640b4d3b6acdd36431e6d825","effectsContract":"1.0.0","journalEntryDigest":"sha256:555516c46fd59ce2156b5352dc295934e2065e4810c877965c0c43020b6f8fd6","occurredAt":"2026-09-08T21:12:43.104Z","operation":"moc:replace","planDigest":"sha256:cee18a11185886d51461cb7b1c6deb7782b24807c7fff63a1998163232dfc780","policyRef":{"digest":"sha256:bbbbbbbbbbbbbbbbbbbbbbbbbbbbbbbbbbbbbbbbbbbbbbbbbbbbbbbbbbbbbbbb","id":"soak","version":"1"},"reasonCodes":["BYTE_IDENTICAL"],"receiptId":"receipt:effect:5306d341640b4d3b6acdd36431e6d825","sourceContentIncluded":false,"status":"no-op","targetPath":"notes/index.md"}
