{"afterDigest":"sha256:bbd35e22f8acbab0ded1386ac665c658edd203d73cd4baba2e77df27a9e4246f","archiveManifestDigest":"sha256:9a9ec59558fb712f925361771d9c3a3176a92a89267efd9a60c8c77b717ac0df","artifactKind":"engine.navigation-effect-receipt","authorityDigest":"sha256:e842b8c76b822f717047c2318b818bd29e19eb7310f0587ee20a70d09c34ae2f","beforeDigest":"sha256:df8ce766af679e0333817103bc6bb3d2cc808faaf78e6fc1518a96178ea834df","effectId":"effect:0db1215da8e8e213ddae7089acfe080d","effectsContract":"1.0.0","journalEntryDigest":"sha256:c9d63e609896c09aecfe997bb6f620fa72a675202c908ae0fc1950d86e8d076c","occurredAt":"2026-09-08T21:12:59.589Z","operation":"moc:replace","planDigest":"sha256:d1f42f466dcf8aa285471f9bfd6d21d2a45cb50f666cdbbc439385b8472b833e","policyRef":{"digest":"sha256:bbbbbbbbbbbbbbbbbbbbbbbbbbbbbbbbbbbbbbbbbbbbbbbbbbbbbbbbbbbbbbbb","id":"soak","version":"1"},"reasonCodes":[],"receiptId":"receipt:effect:0db1215da8e8e213ddae7089acfe080d","sourceContentIncluded":false,"status":"committed","targetPath":"notes/index.md"}
