{"afterDigest":"sha256:373f1d58ffd2b01c2c74ae10a5829e62682555a346d6b0dd19cc3b4ccfec325a","archiveManifestDigest":"sha256:87f08c2ad9e6d927d16ef1f4b3e1ecdc471821de70e35927bee76f56e8225d9b","artifactKind":"engine.navigation-effect-receipt","authorityDigest":"sha256:e842b8c76b822f717047c2318b818bd29e19eb7310f0587ee20a70d09c34ae2f","beforeDigest":"sha256:672ac1a8f5f2c6cfb9dfc5045647bc9a2725df6f39180656febdca73a1ef9924","effectId":"effect:4a56fd8513c1b4831c3471cb306583ef","effectsContract":"1.0.0","journalEntryDigest":"sha256:fbdf562416f9d22ff7d7aa763ea11638188ba60d4bbe8c4859433bd647a5534a","occurredAt":"2026-09-08T20:36:52.289Z","operation":"moc:replace","planDigest":"sha256:217f465a815868d596510208b3b037ec218e178c497ff89adb4bfb21a7657064","policyRef":{"digest":"sha256:bbbbbbbbbbbbbbbbbbbbbbbbbbbbbbbbbbbbbbbbbbbbbbbbbbbbbbbbbbbbbbbb","id":"soak","version":"1"},"reasonCodes":[],"receiptId":"receipt:effect:4a56fd8513c1b4831c3471cb306583ef","sourceContentIncluded":false,"status":"committed","targetPath":"notes/index.md"}
