{"afterDigest":"sha256:5467db8ee8bb4ce69e4dbc6f97b06cec7b60da7bcea9c999813f504c1b1f055e","archiveManifestDigest":"sha256:7ec244c15533e63a9c353414541bdedb76cbe0a35231fea638aa6d2f390af12b","artifactKind":"engine.navigation-effect-receipt","authorityDigest":"sha256:e842b8c76b822f717047c2318b818bd29e19eb7310f0587ee20a70d09c34ae2f","beforeDigest":"sha256:153d42c0c31e1764c1647599dcea2deca2eada22be6b6353c87a6934db819695","effectId":"effect:12ffb4673cf89ecf617a963523c8c855","effectsContract":"1.0.0","journalEntryDigest":"sha256:458fa8743c7fe0a3c7056df24f6575630d94822ffe2f2e293f0eb6403cb01df1","occurredAt":"2026-09-08T20:30:50.818Z","operation":"moc:replace","planDigest":"sha256:ea549ab0b32b5ba238259bf4fbb0f77aaa98777535fea1b9883d2f57cd52ea38","policyRef":{"digest":"sha256:bbbbbbbbbbbbbbbbbbbbbbbbbbbbbbbbbbbbbbbbbbbbbbbbbbbbbbbbbbbbbbbb","id":"soak","version":"1"},"reasonCodes":[],"receiptId":"receipt:effect:12ffb4673cf89ecf617a963523c8c855","sourceContentIncluded":false,"status":"committed","targetPath":"notes/index.md"}
