{"afterDigest":"sha256:931e0975f69a15729b745c17942a6e2cc345df72cf15c3d1195f003e60019bb2","artifactKind":"engine.navigation-effect-receipt","authorityDigest":"sha256:e842b8c76b822f717047c2318b818bd29e19eb7310f0587ee20a70d09c34ae2f","beforeDigest":"sha256:931e0975f69a15729b745c17942a6e2cc345df72cf15c3d1195f003e60019bb2","effectId":"effect:083c937699f8abfb191b2e3c28a436db","effectsContract":"1.0.0","journalEntryDigest":"sha256:938dbbbf4c4092a4f31ce9fe915289c6c9f6a774e639961b77459cffa4595330","occurredAt":"2026-09-08T21:13:18.588Z","operation":"moc:replace","planDigest":"sha256:cb45d7151fccc54d8723425ff86f898605451bf84c828ba4b4b644251dfa380f","policyRef":{"digest":"sha256:bbbbbbbbbbbbbbbbbbbbbbbbbbbbbbbbbbbbbbbbbbbbbbbbbbbbbbbbbbbbbbbb","id":"soak","version":"1"},"reasonCodes":["BYTE_IDENTICAL"],"receiptId":"receipt:effect:083c937699f8abfb191b2e3c28a436db","sourceContentIncluded":false,"status":"no-op","targetPath":"notes/index.md"}
