{"afterDigest":"sha256:15c0c9d0f83abc7718c3a5e57f1c9342919b878c69f77262ca2bb5037e36fbe7","artifactKind":"engine.navigation-effect-receipt","authorityDigest":"sha256:e842b8c76b822f717047c2318b818bd29e19eb7310f0587ee20a70d09c34ae2f","beforeDigest":"sha256:15c0c9d0f83abc7718c3a5e57f1c9342919b878c69f77262ca2bb5037e36fbe7","effectId":"effect:eaa67adef74f1a26c4627f42ccece886","effectsContract":"1.0.0","journalEntryDigest":"sha256:490b9df532ada2739471db2e3d37fe52f6d5cd786901fbeeb4528a9b59062d9a","occurredAt":"2026-09-08T20:16:51.259Z","operation":"moc:replace","planDigest":"sha256:fca99c18c5fcd1a19a01c1454aab296f65f469cb39f63b11a4b8872071aa6d19","policyRef":{"digest":"sha256:bbbbbbbbbbbbbbbbbbbbbbbbbbbbbbbbbbbbbbbbbbbbbbbbbbbbbbbbbbbbbbbb","id":"soak","version":"1"},"reasonCodes":["BYTE_IDENTICAL"],"receiptId":"receipt:effect:eaa67adef74f1a26c4627f42ccece886","sourceContentIncluded":false,"status":"no-op","targetPath":"notes/index.md"}
