{"afterDigest":"sha256:622b1c3d158254698149037b83a4646871f9621c5502e0df860ecb11b04d6799","archiveManifestDigest":"sha256:2e84abb96b674fafd680b540bb91a379e1b05d26cbc17aff62a44814cbf6e9cd","artifactKind":"engine.navigation-effect-receipt","authorityDigest":"sha256:e842b8c76b822f717047c2318b818bd29e19eb7310f0587ee20a70d09c34ae2f","beforeDigest":"sha256:373f1d58ffd2b01c2c74ae10a5829e62682555a346d6b0dd19cc3b4ccfec325a","effectId":"effect:b5df819cae5af89a7756ca0038877b46","effectsContract":"1.0.0","journalEntryDigest":"sha256:1cdb4dbb7ea3767404fdc314a5d17d694a33266d0e51817ed35a190d11ba68f5","occurredAt":"2026-09-08T20:40:51.998Z","operation":"moc:replace","planDigest":"sha256:3fac4ced77748e3734c28f624437c95e46b7d1dffc78fb864290a10c268823be","policyRef":{"digest":"sha256:bbbbbbbbbbbbbbbbbbbbbbbbbbbbbbbbbbbbbbbbbbbbbbbbbbbbbbbbbbbbbbbb","id":"soak","version":"1"},"reasonCodes":[],"receiptId":"receipt:effect:b5df819cae5af89a7756ca0038877b46","sourceContentIncluded":false,"status":"committed","targetPath":"notes/index.md"}
