{"afterDigest":"sha256:51356e3aa0c5d2f105a39edc0183057e3a3b9c674ff8c9585ac767df3ba620f4","artifactKind":"engine.navigation-effect-receipt","authorityDigest":"sha256:e842b8c76b822f717047c2318b818bd29e19eb7310f0587ee20a70d09c34ae2f","beforeDigest":"sha256:51356e3aa0c5d2f105a39edc0183057e3a3b9c674ff8c9585ac767df3ba620f4","effectId":"effect:fbf34b1c1119052360310b0bcaf60a7b","effectsContract":"1.0.0","journalEntryDigest":"sha256:25c1783c4e7b273b32d670bd456f5673a08904fe4da06ed09f1553e9e930b552","occurredAt":"2026-09-08T20:44:50.562Z","operation":"moc:replace","planDigest":"sha256:d810fd96e9b719f1d00574d4d943a2b54fd5b4178e766483ef47d7614d6e9a1f","policyRef":{"digest":"sha256:bbbbbbbbbbbbbbbbbbbbbbbbbbbbbbbbbbbbbbbbbbbbbbbbbbbbbbbbbbbbbbbb","id":"soak","version":"1"},"reasonCodes":["BYTE_IDENTICAL"],"receiptId":"receipt:effect:fbf34b1c1119052360310b0bcaf60a7b","sourceContentIncluded":false,"status":"no-op","targetPath":"notes/index.md"}
