{"afterDigest":"sha256:adc742084951790f31757179f6889003a762f159bc94c3837c26fbe8d3d164e8","archiveManifestDigest":"sha256:4c1da15a2105a4fa2640e29b87ac425b9b7ff10e267a66f7dacbc984374bf97e","artifactKind":"engine.navigation-effect-receipt","authorityDigest":"sha256:e842b8c76b822f717047c2318b818bd29e19eb7310f0587ee20a70d09c34ae2f","beforeDigest":"sha256:931e0975f69a15729b745c17942a6e2cc345df72cf15c3d1195f003e60019bb2","effectId":"effect:b09e2f3a737e38c038ab6e7fb8973315","effectsContract":"1.0.0","journalEntryDigest":"sha256:13d3269f913d7cfc25c7b69236b74ded9a8ac7585758f4cef371df169915e12c","occurredAt":"2026-09-08T21:13:49.164Z","operation":"moc:replace","planDigest":"sha256:34f42a8f20cffe81383cd7076eb8e138264eb73ae09889dc4627c0a6ba725b6e","policyRef":{"digest":"sha256:bbbbbbbbbbbbbbbbbbbbbbbbbbbbbbbbbbbbbbbbbbbbbbbbbbbbbbbbbbbbbbbb","id":"soak","version":"1"},"reasonCodes":[],"receiptId":"receipt:effect:b09e2f3a737e38c038ab6e7fb8973315","sourceContentIncluded":false,"status":"committed","targetPath":"notes/index.md"}
