{"afterDigest":"sha256:f6552f4b55d88f694401be0a76f4d064b408ebe0e3dbe39ba41cecd80662065a","artifactKind":"engine.navigation-effect-receipt","authorityDigest":"sha256:e842b8c76b822f717047c2318b818bd29e19eb7310f0587ee20a70d09c34ae2f","beforeDigest":"sha256:f6552f4b55d88f694401be0a76f4d064b408ebe0e3dbe39ba41cecd80662065a","effectId":"effect:d4c4bf4bf0d5eb5a570b953439245bb1","effectsContract":"1.0.0","journalEntryDigest":"sha256:7b20531a71c3d3171908d3c6a0634dcd592fcd8a0e1ea570b02b860744508040","occurredAt":"2026-09-08T20:20:49.749Z","operation":"moc:replace","planDigest":"sha256:e542dadbf58995b9b5491ff2015200a9349a6e9624b150aa984eb53850d327cb","policyRef":{"digest":"sha256:bbbbbbbbbbbbbbbbbbbbbbbbbbbbbbbbbbbbbbbbbbbbbbbbbbbbbbbbbbbbbbbb","id":"soak","version":"1"},"reasonCodes":["BYTE_IDENTICAL"],"receiptId":"receipt:effect:d4c4bf4bf0d5eb5a570b953439245bb1","sourceContentIncluded":false,"status":"no-op","targetPath":"notes/index.md"}
