{"afterDigest":"sha256:153d42c0c31e1764c1647599dcea2deca2eada22be6b6353c87a6934db819695","archiveManifestDigest":"sha256:87b4ad693299908aa0a4c94e758b423fbe9dada4ef655aa1d56247a99b772c13","artifactKind":"engine.navigation-effect-receipt","authorityDigest":"sha256:e842b8c76b822f717047c2318b818bd29e19eb7310f0587ee20a70d09c34ae2f","beforeDigest":"sha256:15c0c9d0f83abc7718c3a5e57f1c9342919b878c69f77262ca2bb5037e36fbe7","effectId":"effect:c8f0d1162afc2892151588bbaa3eeec4","effectsContract":"1.0.0","journalEntryDigest":"sha256:68e7ecd8e89dff3147a8c69251065c74c060f0ea35b038358f6674e680d306bf","occurredAt":"2026-09-08T20:17:07.479Z","operation":"moc:replace","planDigest":"sha256:ef3e06ebfb636a1371cbce18084ee6feacacfe688e0c181dbf78289140ec489a","policyRef":{"digest":"sha256:bbbbbbbbbbbbbbbbbbbbbbbbbbbbbbbbbbbbbbbbbbbbbbbbbbbbbbbbbbbbbbbb","id":"soak","version":"1"},"reasonCodes":[],"receiptId":"receipt:effect:c8f0d1162afc2892151588bbaa3eeec4","sourceContentIncluded":false,"status":"committed","targetPath":"notes/index.md"}
