{"afterDigest":"sha256:373f1d58ffd2b01c2c74ae10a5829e62682555a346d6b0dd19cc3b4ccfec325a","artifactKind":"engine.navigation-effect-receipt","authorityDigest":"sha256:e842b8c76b822f717047c2318b818bd29e19eb7310f0587ee20a70d09c34ae2f","beforeDigest":"sha256:373f1d58ffd2b01c2c74ae10a5829e62682555a346d6b0dd19cc3b4ccfec325a","effectId":"effect:1104718c5b8d8c2338655b413a9daa2b","effectsContract":"1.0.0","journalEntryDigest":"sha256:eedbff2f14b343296fd00da94bc3c9a34fd1f7e1509fd84d249515d9e3d0f540","occurredAt":"2026-09-08T20:38:51.542Z","operation":"moc:replace","planDigest":"sha256:670b02f009572e6f9debc920b71d92271670f1e048ea0fa1d709283d76249353","policyRef":{"digest":"sha256:bbbbbbbbbbbbbbbbbbbbbbbbbbbbbbbbbbbbbbbbbbbbbbbbbbbbbbbbbbbbbbbb","id":"soak","version":"1"},"reasonCodes":["BYTE_IDENTICAL"],"receiptId":"receipt:effect:1104718c5b8d8c2338655b413a9daa2b","sourceContentIncluded":false,"status":"no-op","targetPath":"notes/index.md"}
