{"afterDigest":"sha256:672ac1a8f5f2c6cfb9dfc5045647bc9a2725df6f39180656febdca73a1ef9924","archiveManifestDigest":"sha256:da1aff5ef047dc3310b9214b14b9c6a8fe51a55750e76e2dcca09161aefc52b2","artifactKind":"engine.navigation-effect-receipt","authorityDigest":"sha256:e842b8c76b822f717047c2318b818bd29e19eb7310f0587ee20a70d09c34ae2f","beforeDigest":"sha256:5467db8ee8bb4ce69e4dbc6f97b06cec7b60da7bcea9c999813f504c1b1f055e","effectId":"effect:12adb0a8afe619d074199693c249a02a","effectsContract":"1.0.0","journalEntryDigest":"sha256:6f1fa527fbf69982399bf76e75477dff41b7efbaed40af4ee5016912106f6391","occurredAt":"2026-09-08T20:17:53.089Z","operation":"moc:replace","planDigest":"sha256:3c69e81f3061cc8acb49686bac6fd13b914476702615e153a46ce28e570b1dae","policyRef":{"digest":"sha256:bbbbbbbbbbbbbbbbbbbbbbbbbbbbbbbbbbbbbbbbbbbbbbbbbbbbbbbbbbbbbbbb","id":"soak","version":"1"},"reasonCodes":[],"receiptId":"receipt:effect:12adb0a8afe619d074199693c249a02a","sourceContentIncluded":false,"status":"committed","targetPath":"notes/index.md"}
